{
  "version": "2.0",
  "asset_id": "urn:uuid:550e8400-e29b-41d4-a716-446655440010",
  "kind": "rendered-view",
  "name": "Bunny front-view render (640x480)",
  "created_at": "2025-05-01T09:15:00Z",
  "derived_from": ["urn:uuid:550e8400-e29b-41d4-a716-446655440001"],
  "representations": [
    {
      "rep_id": "rep-png-front",
      "format": "png",
      "uri": "samples/inspection/rendered_front.png",
      "mime_type": "image/png",
      "image_width": 640,
      "image_height": 480,
      "viewpoint_id": "vp-front"
    }
  ],
  "viewpoints": [
    {
      "viewpoint_id": "vp-front",
      "label": "Front view",
      "position": [0.0, 0.09, 0.4],
      "target": [0.0, 0.09, 0.0],
      "up": [0.0, 1.0, 0.0],
      "fov_y_deg": 45.0,
      "near": 0.01,
      "far": 10.0,
      "image_width": 640,
      "image_height": 480
    }
  ],
  "workflow": {
    "step": "render",
    "target_asset_id": "urn:uuid:550e8400-e29b-41d4-a716-446655440001",
    "viewpoint_id": "vp-front",
    "tool": "matplotlib-scatter-render",
    "tool_version": "1.0.0",
    "completed_at": "2025-05-01T09:15:02Z"
  },
  "metadata": {
    "renderer": "matplotlib 3D scatter",
    "dpi": 100
  }
}
